{
  "$schema": "http://json-schema.org/draft-04/schema#",
  "type": "object",
  "properties": {
    "id": {
      "type": "string"
    },
    "first_name": {
      "type": "string"
    },
    "last_name": {
      "type": "string"
    },
    "email": {
      "type": "string"
    },
    "address": {
      "type": "object",
      "properties": {
        "street_address": {
          "type": "string"
        },
        "city": {
          "type": "string"
        },
        "state": {
          "type": "string"
        },
        "postal_code": {
          "type": "string"
        },
        "country": {
          "type": "string"
        }
      },
      "required": [
        "street_address",
        "city",
        "state",
        "postal_code",
        "country"
      ]
    },
    "favorite_foods": {
      "type": "array",
      "items": [
        {
          "type": "string"
        },
        {
          "type": "string"
        },
        {
          "type": "string"
        }
      ]
    }
  },
  "required": [
    "id",
    "first_name",
    "last_name",
    "email",
    "address",
    "favorite_foods"
  ]
}